{
    "$schema": "http://json-schema.org/schema#",
    "id": "configuration_schema.json",
    
    "type": "object",
    "properties": {
        "name":             { "type": "string" },
        "description":      { "type": "string" },
        "module":           { "type": "string" },
        "input_schema":     { "type": "object" }
    },
    "required": ["name","description","module","input_schema"],
    "additionalProperties": false
}