{
    "name": "GAUSSIAN",
    "description": "Gaussian 16 Driver",
    "module": "gaussiandriver",
    "input_schema" : {
        "$schema": "http://json-schema.org/schema#",
        "id": "gaussian_schema",
        "type": "string",
        "default": "# rhf/sto-3g scf(conventional)\n\nh2 molecule\n\n0 1\nH   0.0  0.0    0.0\nH   0.0  0.0    0.735\n\n"
    }
}
          